{
  "$schema": "http://json-schema.org/draft-07/schema#",
  "type": "object",
  "required": ["number", "date", "seller", "buyer", "items", "total_tiyn", "total", "total_words"],
  "properties": {
    "number": {"type": "string", "minLength": 1},
    "date": {"type": "string", "pattern": "^\\d{2}\\.\\d{2}\\.\\d{4}$"},
    "seller": {"$ref": "#/definitions/party"},
    "buyer": {"$ref": "#/definitions/party"},
    "contract": {"type": "string"},
    "items": {"type": "array", "minItems": 1, "items": {
      "type": "object",
      "required": ["name", "qty", "unit", "price", "amount"],
      "properties": {
        "name": {"type": "string"}, "qty": {"type": "string"}, "unit": {"type": "string"},
        "price": {"type": "string"}, "amount": {"type": "string"}
      }}},
    "vat_rate": {"type": "string"}, "vat_amount": {"type": "string"},
    "total_tiyn": {"type": "integer", "minimum": 0},
    "total": {"type": "string"}, "total_words": {"type": "string"}
  },
  "definitions": {
    "party": {
      "type": "object",
      "required": ["name", "identifier"],
      "properties": {
        "name": {"type": "string"}, "identifier": {"type": "string"},
        "address": {"type": "string"}, "iik": {"type": "string"},
        "bik": {"type": "string"}, "bank": {"type": "string"}, "kbe": {"type": "string"}
      }}
  }
}
